<?xml version="1.0" encoding="UTF-8"?>
<graph xmlns:xsi="http://www.w3.org/2001/XMLSchema-instance" xsi:noNamespaceSchemaLocation="../xsdFiles/graph.xsd">
  <name>name</name>
  <directed>true</directed>
  <vertex>
    <name>name</name>
    <location>
      <x>0</x>
      <y>0</y>
    </location>
    <size>
      <x>0</x>
      <y>0</y>
    </size>
  </vertex>
  <vertex>
  	<name>name</name>
  	<location>
  		<x>0</x>
  		<y>0</y>
  	</location>
  	<size>
  		<x>0</x>
  		<y>0</y>
  	</size>
  </vertex>
  <edge>
    <from>from</from>
    <to>to</to>
    <weight>0</weight>
  </edge>
  <edge>
  	<from>from</from>
  	<to>to</to>
  	<weight>0</weight>
  </edge>
</graph>
